{
  "$schema": "https://json-schema.org/draft/2020-12/schema",
  "$id": "https://merinoeluis.github.io/Pole-Calculator/schemas/autoproposed.schema.json",
  "title": "Pole Calculator Compact AutoProposed Export",
  "description": "Structural contract shared by Pole-Calculator Web and the O-Calc AutoProposed plugin. Heights and span lengths are integer inches; bearings are decimal degrees.",
  "type": "object",
  "additionalProperties": false,
  "required": ["project", "sizes", "owner", "poles"],
  "properties": {
    "project": {
      "type": "string",
      "minLength": 1,
      "description": "Active project whose rules govern this proposal."
    },
    "workInstruction": {
      "type": "string",
      "enum": ["MIDAM", "CSU", "COMED"],
      "description": "MetroNet work instruction when project is METRONET."
    },
    "sizes": { "$ref": "#/$defs/sizes" },
    "owner": {
      "type": "string",
      "minLength": 1,
      "description": "Owner selected for the proposed fiber."
    },
    "poles": {
      "type": "array",
      "items": { "$ref": "#/$defs/pole" }
    }
  },
  "allOf": [
    {
      "if": {
        "properties": { "project": { "const": "METRONET" } },
        "required": ["project"]
      },
      "then": { "required": ["workInstruction"] }
    }
  ],
  "$defs": {
    "integerInches": {
      "type": "integer",
      "description": "Distance or height expressed as whole inches."
    },
    "positiveSize": {
      "type": ["number", "null"],
      "exclusiveMinimum": 0
    },
    "sizes": {
      "type": "object",
      "additionalProperties": false,
      "required": ["messenger", "fiber"],
      "properties": {
        "messenger": { "$ref": "#/$defs/positiveSize" },
        "fiber": {
          "type": "object",
          "propertyNames": { "pattern": "^[0-9]+$" },
          "additionalProperties": { "$ref": "#/$defs/positiveSize" }
        }
      }
    },
    "move": {
      "type": "object",
      "additionalProperties": false,
      "required": ["owner", "from", "to"],
      "properties": {
        "owner": { "type": "string", "minLength": 1 },
        "from": { "$ref": "#/$defs/integerInches" },
        "to": { "$ref": "#/$defs/integerInches" },
        "service": { "type": "boolean" },
        "dg": { "type": "boolean" }
      }
    },
    "riser": {
      "type": "object",
      "additionalProperties": false,
      "required": ["action", "hoa"],
      "properties": {
        "action": { "enum": ["place", "raise"] },
        "direction": { "type": "string", "pattern": "^(N|NE|E|SE|S|SW|W|NW)$" },
        "hoa": { "$ref": "#/$defs/integerInches" },
        "fromHoa": { "$ref": "#/$defs/integerInches" },
        "owner": { "type": "string", "minLength": 1 },
        "angle": { "type": "number", "minimum": 0, "exclusiveMaximum": 360 }
      },
      "allOf": [
        {
          "if": {
            "properties": { "action": { "const": "raise" } },
            "required": ["action"]
          },
          "then": {
            "required": ["fromHoa", "owner"]
          }
        },
        {
          "if": {
            "properties": { "action": { "const": "place" } },
            "required": ["action"]
          },
          "then": {
            "required": ["direction"],
            "not": {
              "anyOf": [
                { "required": ["fromHoa"] },
                { "required": ["owner"] },
                { "required": ["angle"] }
              ]
            }
          }
        }
      ]
    },
    "anc": {
      "type": "object",
      "additionalProperties": false,
      "required": ["distance"],
      "description": "Enabled anchor action. Distance is the effective ANC reach in whole inches. Direction is omitted when the operator has not selected one.",
      "properties": {
        "distance": {
          "$ref": "#/$defs/integerInches",
          "minimum": 1
        },
        "direction": {
          "type": "string",
          "pattern": "^(N|NE|E|SE|S|SW|W|NW)$"
        }
      }
    },
    "span": {
      "type": "object",
      "additionalProperties": false,
      "required": ["to", "kind"],
      "properties": {
        "to": { "type": "string", "minLength": 1 },
        "kind": { "enum": ["F", "B", "O"] },
        "bearing": { "type": "number", "minimum": 0, "exclusiveMaximum": 360 },
        "length": { "$ref": "#/$defs/integerInches" },
        "hoa": { "$ref": "#/$defs/integerInches" },
        "fiber": { "type": "integer", "minimum": 1 },
        "endDrop": { "$ref": "#/$defs/integerInches" },
        "nextHoa": { "$ref": "#/$defs/integerInches" },
        "overlash": {
          "type": "boolean",
          "description": "Place the proposed fiber over the existing messenger owned by the exported job owner; do not create a new messenger."
        },
        "slack": {
          "type": "boolean",
          "description": "The proposed span is marked as Slack by the operator. This flag does not perform tension or O-Calc calculations."
        },
        "ug": { "type": "boolean" }
      },
      "allOf": [
        {
          "if": {
            "properties": { "ug": { "const": true } },
            "required": ["ug"]
          },
          "then": {
            "not": {
              "anyOf": [
                { "required": ["hoa"] },
                { "required": ["fiber"] },
                { "required": ["endDrop"] },
                { "required": ["nextHoa"] }
              ]
            }
          }
        }
      ]
    },
    "pole": {
      "type": "object",
      "additionalProperties": false,
      "required": ["id"],
      "properties": {
        "id": { "type": "string", "minLength": 1 },
        "pco": { "type": "boolean" },
        "terminalHoa": { "$ref": "#/$defs/integerInches" },
        "spans": {
          "type": "array",
          "items": { "$ref": "#/$defs/span" }
        },
        "moves": {
          "type": "array",
          "items": { "$ref": "#/$defs/move" }
        },
        "anc": {
          "$ref": "#/$defs/anc"
        },
        "dgHoa": {
          "$ref": "#/$defs/integerInches",
          "description": "Effective down-guy attachment HOA in whole inches; defaults to Proposed when the operator has not entered a DG HOA."
        },
        "riser": {
          "$ref": "#/$defs/riser"
        }
      },
      "allOf": [
        {
          "if": {
            "properties": { "pco": { "const": true } },
            "required": ["pco"]
          },
          "then": {
            "not": {
              "anyOf": [
                { "required": ["terminalHoa"] },
                { "required": ["moves"] },
                { "required": ["anc"] },
                { "required": ["dgHoa"] },
                { "required": ["riser"] }
              ]
            }
          }
        }
      ]
    }
  }
}
