{
  "project": "INTEC",
  "sizes": {
    "messenger": null,
    "fiber": {}
  },
  "owner": "Wecom",
  "poles": [
    {
      "id": "P16 UG",
      "spans": [
        {
          "to": "P15",
          "kind": "B",
          "bearing": 270,
          "length": 1200,
          "ug": true
        }
      ]
    }
  ]
}
