{
  "project": "INTEC",
  "sizes": {
    "messenger": 0.242,
    "fiber": {
      "144": 0.51
    }
  },
  "owner": "Wecom",
  "poles": [
    {
      "id": "P1",
      "spans": [
        {
          "to": "P2",
          "kind": "F",
          "bearing": 90,
          "length": 1200,
          "hoa": 264,
          "fiber": 144
        }
      ],
      "moves": [
        {
          "owner": "CTL",
          "from": 216,
          "to": 228
        }
      ]
    }
  ]
}
