{
  "project": "INTEC",
  "sizes": {
    "messenger": 0.242,
    "fiber": {
      "144": 0.51
    }
  },
  "owner": "Wecom",
  "poles": [
    {
      "id": "P01",
      "spans": [
        { "to": "P02", "kind": "F", "bearing": 90, "length": 1200, "hoa": 264, "fiber": 144 },
        { "to": "P03", "kind": "O", "bearing": 0, "length": 840, "ug": true },
        { "to": "P04", "kind": "O", "bearing": 180, "length": 720 }
      ],
      "moves": [
        { "owner": "CTL", "from": 216, "to": 228 },
        { "owner": "CATV", "from": 240, "to": 252, "dg": true }
      ]
    }
  ]
}
